{
  "inputDir": "./input",
  "outputDir": "./runs/slideclone-flow-rules",
  "pagePattern": "*.png",
  "slide": {
    "widthPt": 960,
    "heightPt": 540
  },
  "adapters": {
    "normalize": "scripts/adapters/normalize-regions.js",
    "ocr": "scripts/adapters/ocr-placeholder.js",
    "vision": "scripts/adapters/vision-flow-diagram-rules.js",
    "pptx": "scripts/adapters/pptx-python-pptx.js",
    "render": "scripts/adapters/render-powerpoint-com.js",
    "diff": "scripts/adapters/diff-pixel-png.js",
    "compare": "scripts/adapters/compare-placeholder.js",
    "polish": "scripts/adapters/polish-flow-diagram-rules.js",
    "compress": "scripts/adapters/compress-pptx-media.js"
  },
  "regionProposal": {
    "includeFullPage": true,
    "emitRegionPages": false,
    "cropContainer": false,
    "minConfidence": 0.45,
    "minAreaRatio": 0.035,
    "maxAreaRatio": 0.72,
    "paddingPx": 4,
    "innerPaddingPx": 4,
    "innerHeaderSkipRatio": 0.18
  },
  "thresholds": {
    "pixelDiffRatio": 0.08,
    "foregroundMissingRatio": 0.12,
    "layoutMeanIoU": 0.86,
    "textCoverage": 0.95,
    "maxCriticalOffsetPt": 8,
    "maxOutOfBoundsPt": 1,
    "maxImageAspectRatioDelta": 0.03,
    "maxRasterImageAreaRatio": 0.25
  },
  "compress": {
    "jpegQuality": 88,
    "pngCompressLevel": 9,
    "maxImagePixels": 0,
    "minSavingBytes": 128
  },
  "diff": {
    "foregroundTolerancePx": 2,
    "foregroundToleranceDelta": 54
  },
  "maxIterations": 1,
  "postprocess": {
    "compare": true,
    "polish": true,
    "compress": true,
    "verifyCompressed": true,
    "stopWhenThresholdPassed": true
  }
}
