{
  "inputDir": "./input",
  "outputDir": "./runs/slideclone-pptx-image-com",
  "pagePattern": "*.{ppt,pptx,png,jpg,jpeg,webp}",
  "slide": {
    "widthPt": 960,
    "heightPt": 540
  },
  "adapters": {
    "normalize": "scripts/adapters/normalize-powerpoint-com.js",
    "ocr": "scripts/adapters/ocr-placeholder.js",
    "vision": "scripts/adapters/vision-flow-diagram-rules.js",
    "pptx": "scripts/adapters/pptx-python-pptx.js",
    "render": "scripts/adapters/render-powerpoint-com.js",
    "diff": "scripts/adapters/diff-pixel-png.js",
    "compare": "scripts/adapters/compare-placeholder.js",
    "polish": "scripts/adapters/polish-flow-diagram-rules.js",
    "compress": "scripts/adapters/compress-pptx-media.js"
  },
  "normalize": {
    "exportWidthPx": 1920,
    "exportHeightPx": 1080
  },
  "powerPoint": {
    "cleanupHidden": true
  },
  "compress": {
    "jpegQuality": 88,
    "pngCompressLevel": 9,
    "maxImagePixels": 0,
    "minSavingBytes": 128
  },
  "diff": {
    "foregroundTolerancePx": 2,
    "foregroundToleranceDelta": 54
  },
  "fontFit": {
    "enabled": false,
    "candidates": [
      "Microsoft YaHei",
      "SimHei",
      "DengXian",
      "Arial"
    ]
  },
  "textOcr": {
    "enabled": false,
    "adapter": "scripts/adapters/ocr-umi-paddle.js",
    "mode": "anchored",
    "paddingPt": 16,
    "upscale": 1,
    "psm": 6,
    "preprocess": false
  },
  "umiOcr": {
    "paddleBin": "C:\\Program Files\\Umi-OCR_Paddle_v2.1.5\\UmiOCR-data\\plugins\\win7_x64_PaddleOCR-json\\PaddleOCR-json.exe",
    "initTimeoutMs": 60000
  },
  "tesseract": {
    "bin": "tesseract",
    "lang": "chi_sim+eng",
    "tessdataPrefix": "./tools/tessdata",
    "psm": 6
  },
  "regionProposal": {
    "includeFullPage": true,
    "emitRegionPages": false,
    "cropContainer": false,
    "minConfidence": 0.45,
    "minAreaRatio": 0.035,
    "maxAreaRatio": 0.72,
    "paddingPx": 4,
    "innerPaddingPx": 4,
    "innerHeaderSkipRatio": 0.18
  },
  "thresholds": {
    "pixelDiffRatio": 0.08,
    "foregroundMissingRatio": 0.12,
    "layoutMeanIoU": 0.86,
    "textCoverage": 0.95,
    "maxCriticalOffsetPt": 8,
    "maxOutOfBoundsPt": 1,
    "maxImageAspectRatioDelta": 0.03,
    "maxRasterImageAreaRatio": 0.25
  },
  "maxIterations": 1,
  "postprocess": {
    "compare": true,
    "polish": true,
    "compress": true,
    "verifyCompressed": true,
    "stopWhenThresholdPassed": true
  }
}
